Gabriela Salazar,Asumi,Letters & Science Collegiate Senator,https://dailynexus.s3.us-west-1.amazonaws.com/dailynexus/wp-content/uploads/2023/04/23131539/Gabriela_Salazar.jpg,,she/her,second-year,Political Science and Latin American and Iberian Studies,,,"""I am running to be your next senator to address the impacts COVID had on students, such
as our mental health, in-person activities, and financial security. During my term, I would
advocate for more financial support and resources for low-income students of all backgrounds to
aid the financial strain COVID created and continue to allow students to have the right to higher
education. I would also work with the different mental health organizations to better promote and
make accessible mental health services to support students' well-being and work on community
building so that students connect better with their campus. Additionally, I have grown to deeply
care for and get involved with our campus, which I now consider my second home. I have made
memorable memories with different communities and professionally developed through the
opportunities and experiences UCSB provides. Similarly, I am dedicated to creating a better UC,
one step at a time, where students feel a sense of belonging and pride when they think of their
university.""","Based on my leadership roles as the student engagement intern at the Undocumented
Student Services, AS Director of Dream Scholar Affairs, and Student Representative of the
Dream Scholar Resource team, I uplift and advocate for students of all backgrounds. As I work
alongside different departments to improve the quality and accessibility of academic and
financial resources necessary to make college affordable and help students navigate college, I
have connected with other students to assess their needs. Through trial and error in attempting to
reach students, I have learned the best ways to increase retention rates, coordinate events, and
create resources based on student needs. I also understand how to advise a diverse group of
students on their college hardships and direct them to resources and services. In doing so, I have
equipped the skills necessary to be a reliable L&S senator, such as how to support and guide
students based on their needs, amplify our voices, and advocate for all students to improve our
better college experience.","While in office, my resolutions would prioritize basic needs and financial and academic
support. One of the three resolutions I propose is to add Basic Needs Vending Machines
throughout different on-campus buildings, including the library, that only require an access card
and PERM number to address food insecurity. The vending machine is a great way to help
students that don't have access to a kitchen, can't afford to buy food all the time, or don't have the
time to stop by the dining halls. They provide various food and personal care items, including
prepackaged salads and sandwiches, soups, drinks, and students whom UCSB's financial crisis
team has approved may use the machine. My second resolution is to work on providing
low-income students with more financial support and resources by increasing emergency grants
and implementing a range of scholarships within department services as an incentive to increase
participation and reach students who are in need. For instance, USS provides various programs to
undocumented students that support them in navigating college, and by applying, students
qualify for a scholarship ranging from $500 to $1,000. I'd also propose bringing back preparatory
courses for competitive classes to adequately prepare students to succeed in their major by
working with different heads of staff and the president. In the past, there were introductory
chemistry and math courses to aid students in a smoother transition to their major classes. These
classes familiarize students with foundational concepts and built their academic confidence as
they feel more prepared for their major courses. During my first year as a Pre-Political Science
major, I had yet to gain experience with coding, stats, or research analysis. However, Professor
Mehta created an introductory course to the mathematical foundations students need in statistics
and political science. His class gave us the confidence we couldn't find anywhere else and
allowed me to pass the class I dreaded with an A.","As a first-generation college student, navigating college was difficult. However, with the
proper resources and guidance, I have come to deeply care for and appreciate UCSB; similarly, I
want my peers to feel that same fondness. To do so, my platform will consist of transparency and
dedication to create a safe and welcoming environment for students to discuss their goals and
concerns in our UCSB community. I will ensure that our voices are amplified and that our
student fees continue to fund resources and services supporting the student body as successful
gauchos. I'll take on the position and future projects with the student's voices in mind to ensure
that my goals aren't only mine but the students'. I will utilize the skills I have learned in my
current positions to organize and connect with different departments, stakeholders, and other
branches to ensure that projects happen with the utmost quality while following university
policies. And even though there may be times when we feel defeated together, we will strive and
continue to use our voices.","I plan to work with EOP, different academic departments, cultural organizations, and the
Undocumented Student Services to reach students of all backgrounds, connect with them on their
needs, and assess them through what they believe will most benefit other students.","As your next senator, I will take on the position transparently to create a safe
environment for everyone to discuss their goals and concerns in our UCSB community. I will
make sure to have office hours in person and on Zoom multiple times a week to provide ample
opportunity for students to meet with me. Additionally, my email will always be open to
everyone to utilize and ask questions or address their concerns, and I will do everything I can to
help.","I am the best candidate for this position because of the passion and skills I have
developed while interning at the Undocumented Student Services and AS Director of Dream
Scholar Affairs. Being a part of AS, I have learned how AS functions and undergoes the process
of coordinating all kinds of events, resources, and legal codes. Through my knowledge of legal
code, I am fully aware of my responsibilities as a senator and how to connect with others within
AS and other departments to collaborate for future projects. USS has also taught me how to
organize events and projects while helping improve services based on students' needs by
reevaluating and connecting with students. My passion for advocating for underrepresented
groups and creating a better college experience for all UCSB students has also grown as I get
more involved with school and build communities that make UCSB memorable. I understand
that all students have diverse college experiences and how crucial it is to cater to these different
needs, which is why it can be frustrating when it feels like we aren't being effectively supported.
However, as your next senator, I will work on creating a safe environment where students will
know their voices will be amplified and validated because it is our college.",Left-leaning ,"Fair. Fair because although the Senate has worked on projects to assess students' needs, I believe the
Senate lacks resources and services that inform students about their work and issues regarding
UCSB.","Yes. Without this resolution, UCSB will continue to support the
violation of human rights in Israel, and it's not what other UCSB students or I represent.","As a low-income student, I believe that UCSB's tuition is expensive, creating an unfair
advantage for most students, but I don't think it should be tuition free. This is because student
fees are necessary and provide general support for how the university provides resources and
events that aid us in our academic and personal lives.","The Mental health services at UCSB provide an array of various discussions, workshops,
and services to aid students from different backgrounds in their well-being but can improve on
the student outreach and counseling sessions that CAPS provides. For many students, CAPS is

where they check in with mental health professionals for counseling. Although CAPS does an
adequate job in short-term therapy, there must be more resources for long-term therapy. The
biggest problem is the issue of scheduling appointments which can take several weeks or even
months, as reported by students. This can be recognized as a need for more staff at such a large
institution. However, it is a significant problem considering that students' well-being is put on
hold and discouraged from attending any other mental health services because of the service at
CAPS. To address this, I would push to hire more mental health professionals so that more
students can access these counseling sessions. Additionally, while the Mental Health Peers and
Health and Wellness provide vast services, students often miss them because most need to be
made aware. To address this, flyers can be put up throughout campus where all students can
access them, such as the dorms, dining halls, and departments, and collaborate with different
departments and organizations to expand their outreach to other students.","I am familiar with and support the Title IX office and its functions. However, the
university can do more to help survivors of sexual assault by increasing the number of mental
health professionals available at CAPS to increase accessibility. Additionally, I would work with
CARE, CAPS, SASA, and Gaucho FYI to better inform all incoming and current students of
how sexual assault, domestic violence, and their rights.","Being a part of these groups, I think USCB can improve how effectively it serves
underrepresented groups. Over the years, I have observed how underrepresented groups struggle
much more with financial security, making higher education a privilege rather than a right.
Additionally, while faculty from different departments and organizations go out of their way to
provide additional help for students to succeed in their majors, there needs to be an improvement
in this being a collective effort. Due to the lack of preparation underrepresented students face, as
most come from low-income backgrounds, we need the support and understanding of all faculty
to let students know they are fully supported. Additionally, while most faculty understand and
make us feel welcomed and supported, there needs to be more diversity, which may create a
disconnect between students and their college as they think they won't be properly supported.","If elected, the first resolution I plan to set up various Basic Needs Vending Machines
throughout campus, including the library, to address food insecurity. I plan to work with different
departments, the library, Basic Needs, and the presidents to organize this project. The Basic
Needs Vending Machines only require an access card and PERM number to access an array of
food and personal care items, including prepackaged salads and sandwiches, soups, and drinks.
Those who don't have access to a kitchen, can't afford to buy food all the time, or don't have the
time to stop by the dining halls can utilize the machine anytime by getting approved by UCSB's
financial crisis team.","Although AS has organized projects that have benefited students of all backgrounds, they
can improve on accessibility due to a majority of students, including myself, not being up to date
with the Senate's work. However, I have learned from my current roles that students are more
involved when consistently reached directly. Therefore, during my term, I would create a weekly
newsletter that informs students of the issues regarding our UCSB community and what the
Senate is doing to address them, as well as opportunities available to them by AS. In doing so,
students are consistently provided news on issues and opportunities to be involved with AS and
on campus. I would also collaborate with different departments and organizations to reach more
students to promote AS-related opportunities and share updates on the Senate's work.","As a senator, I would not have agreed with how the situation was handled because that
only worsened the problem as it got ignored and pushed back. Instead, I would've worked harder
to deal with the problem and propose new steps to ensure it would not happen again. As for the
anti-blackness and discrimination allegations, I would've protected historically marginalized
groups by taking accountability and working with the president to propose the following steps to
ensure that any form of discrimination would never happen. It would also be crucial to focus on
rebuilding a safe and welcoming environment that allows the student body to voice its discontent
with the Senate.","The role of executive orders is to keep AS running smoothly and efficiently whether or
not there is unprecedented dysfunction. The executive order should take proper actions to
prevent a conflict from worsening while keeping the Senate and AS in mind. Executive orders
are the final say and can significantly impact both AS and the Senate, so it's essential to use them
to keep everyone accountable for their actions and maintain the branches in place.","Streamlining the honoraria process is a collective effort, and that would be one of the first
steps to addressing the issue so that everyone takes accountability. I would then work with AS to
spot the problem and propose resolutions to prevent future dysfunctions."
James Fu,Nisha,Engineering Collegiate Senator,https://dailynexus.s3.us-west-1.amazonaws.com/dailynexus/wp-content/uploads/2023/04/23131547/James_Fu.jpg,,he/him,second-year,Computer Science,,,"During the 2022 A.S. spring election, I was disheartened to see that no one ran for the  position of the College of Engineering senator and that the seat remained vacant for almost  two quarters. As a student in the College of Engineering, I felt irrelevant and powerless as  there was no one to represent me.  
Upon doing some further research, referencing the historical data from past AS elections, and  learning more about the current state of the A.S. from current senators, I found that student  participation in the AS, especially, is at a devastating historic low. The voter turnout rate 
during the 2022 spring election dropped 28% in proportion in two years, from almost 29% in  2020 to barely over 20% in 2022, which is nowhere near the 37% median from 2009 - 2019.  Smaller elections, such as the special elections held in 2021 and 2023 winter, consistently  had turnouts lower than 10%. 
Granted, there are some historical reasons that voter turnouts aren’t as high as it was before,  yet it is unmistakable that the A.S. is growing increasingly irrelevant to the student  experience at UCSB. Moreover, this problem has the potential to spiral into a self-fulfilling  prophecy – the more irrelevant A.S. becomes, the fewer people care about it, and it is less  likely that the problem of its irrelevancy is fixed. As time passes, it seems like an  organization like this is doomed to fade into silent obscurity. 
I don’t want that to happen.  
I am not the smartest person, the most qualified person, or the most hard-working person at  UCSB or even in the College of Engineering, far from it. I am a socially awkward student of  average talent whose first language isn’t even English. I have a lot to learn, and the problems  that I have proposed don’t have a simple solution. 
However, the “nobody cares” problem isn’t solved by waiting for the smartest person, the  most qualified person, or the most hard-working person to show up and airdrop a perfect  solution. We simply need somebody, anybody, a nameless nobody, who actually cares about  the problem to start taking small steps in the right direction. If that person really cares, well,  maybe others around them will start caring more.  
I am committed to being that person.","During the fall quarter this year, I was very honored to have been given the opportunity to do  research with faculty in the Computer Science and Computer Engineering departments as  part of the 2022 Early Research Scholars Program cohort. This opportunity gave me  extremely valuable connections to faculty and staff in the College of Engineering as well as  graduate and undergraduate students. If elected, these would be excellent resources for me to  learn about the needs of my constituent. Throughout the program, in combination with my  previous experiences in collaborative environments such as robotics teams and musical  productions, I have also learned and practiced invaluable skills in organizing and mobilizing  a team to accomplish specific goals, such as methods for setting up open, reliable, and  constructive channels of communication, building robust infrastructure for collaboration, and  researching topics thoroughly and efficiently. I believe that these are skills that can only be  learned and perfected through practical application, and they have prepared me very well to  be a senator. ","I am an international student and, therefore, not eligible to vote  in the United States. I am not the most informed about current political issues in the United  States. ",,,,,,,,,,,,,,,,
