Name,Editor,Running For,Photo URL,Endorsement URL,Pronouns,Year,Major,BlurbP1,BlurbP2,Q1,Q2,Q3,Q4,Q5,Q6,Q7,Q8,Q9,Q10,Q11,Q12,Q13,Q14,Q15,Q16,Q17,Q18,Q19
Andrew Devine,Holly,A.S. President,https://dailynexus.s3.us-west-1.amazonaws.com/dailynexus/wp-content/uploads/2023/04/23130959/Mark-Alfred-_-Daily-Nexus1.jpg,,He/Him,third-year,theater,"Platform points: Devine is running on a platform of expand food bank funding, freezing budget increases until A.S. spending becomes more transparent, hosting a UCSB prom for students, and harm reduction practices.","Non-endorsement: While Devine has tangible and innovative platform points, his lack of previous involvement A.S. functions leads the Nexus to believe that Stein would be the better candidate.
",,,,,,,,,,,,,,,,,,,
Jack Stein,Holly,A.S. President,https://dailynexus.s3.us-west-1.amazonaws.com/dailynexus/wp-content/uploads/2023/04/23130940/Jack-Stein-headshot.-MarkAlfred_DailyNexus-1.jpg,https://dailynexus.com/2023-04-20/jack-stein-for-a-s-president/,He/Him,third-year,Political science and data science,"Platform points: Stein is running on a platform of basic-needs advocacy — including expanding the A.S. Food Bank, increasing student knowledge of existing food security programs like CalFresh, expanding equitable technology programs — and streamlining funding processes for campus organizations.",Endorsement: Stein’s work experiences have provided him with a unique understanding of both internal and external A.S. functions.  ,,,,,,,,,,,,,,,,,,,
Jessy Gonzalez,Sindhu,Internal Vice President,https://dailynexus.s3.us-west-1.amazonaws.com/dailynexus/wp-content/uploads/2023/04/23130946/Jessy-Gonzalez-headshot.-NishaMally_DailyNexus-1.jpg,https://dailynexus.com/2023-04-20/jessy-gonzalez-for-internal-vice-president/,He/Him,Third-year,chemical engineering and biochemistry double major,"Platform Points: Gonzalez’s primary platform points are improving cohesion of Senate procedure, increasing transparency of A.S. to the student body and increasing visibility and resource access for students in the S.T.E.M. field.",Endorsement: Gonzalez’s experience in both internal and external A.S. roles provide him with the appropriate skills and perspective to dually amend Senate dysfunction and address student needs.,,,,,,,,,,,,,,,,,,,
Kellen Beckett,Nisha,External Vice President for Local Affairs,https://dailynexus.s3.us-west-1.amazonaws.com/dailynexus/wp-content/uploads/2023/04/23131005/Mark-Alfred-_-Daily-Nexus2.jpg,,He/him,Third-year,political science and writing literature,"Platform Points: Beckett is running on a platform to reopen the A.S. Pardall Center, freely distribute date-rape drug testing and overdose prevention kits and support expanded I.V. self-governance.","Non-endorsement: While the Nexus liked several of Beckett’s policy proposals, his lack of relevant qualifications presented disadvantages to his candidacy. ",,,,,,,,,,,,,,,,,,,
Nathan Lee,Asumi,Student Advocate General,https://dailynexus.s3.us-west-1.amazonaws.com/dailynexus/wp-content/uploads/2023/04/23130952/Mark-Alfred-_-Daily-Nexus.jpg,https://dailynexus.com/2023-04-20/student-advocate-general-no-endorsement-2/,He/Him,Third-year ,Economics and History,Platform Points: Lee emphasized that his platform will focus on negotiating with university administration on academic and conduct policy change,"Non-endorsement: There is more to the SAG position than academic assistance. The needs of the UCSB student community are individually unique, and Lee did not understand this diversity of student concerns nor demonstrated desire to learn.",,,,,,,,,,,,,,,,,,,
Osaze Osayande,Nisha,External Vice President for Local Affairs,https://dailynexus.s3.us-west-1.amazonaws.com/dailynexus/wp-content/uploads/2023/04/23131026/Osaze-Osayande-headshot.-MarkAlfred_DailyNexus-1.jpg,https://dailynexus.com/2023-04-20/osaze-osayande-for-external-vice-president-for-local-affairs/,She/her,Third-year,psychological and brain sciences,"Platform Points: Osayande is running on a platform to reimagine a more inclusive understanding of community safety, increase transparency and accessibility for the office and advocate for UC Santa Barbara students.","Endorsement: The Nexus believes that her experience within the office and her thoughtful proposals for community-oriented alternatives to policing lend her an advantage over her opponent, third-year political science and writing & literature double major Kellen Beckett. ",,,,,,,,,,,,,,,,,,,
Sohum Kalia,Sindhu,Internal Vice President,https://dailynexus.s3.us-west-1.amazonaws.com/dailynexus/wp-content/uploads/2023/04/23131019/Nisha-Mally-_-Daily-Nexus.jpg,,He/Him,Third-year,economics and philosophy double major ,"Platform Points: Kalia's platform points include implementing Senate cohesion, improving financial management, ","Non-Endorsement: Though Kalia thoroughly understands the internal dysfunction the Senate has endured, his solution lacked cohesion and a broader inclusion of student interest.
",,,,,,,,,,,,,,,,,,,
Tessa Veksler,Mark,A.S. President,https://dailynexus.s3.us-west-1.amazonaws.com/dailynexus/wp-content/uploads/2023/04/23131012/Mark-Alfred-_-Daily-Nexus3.jpg,,She/her,Third-year,Political science,"Platform Points: She is running on a platform of basic needs initiatives — including free testing materials and caps and gowns — monthly meetings with RCOs, A.S. financial transparency, updating the A.S. website and continuing the advocacy work of current A.S. President Gurleen Pabla.","Non-Endorsement: While the Nexus concurs that Veksler’s experience could help her step into the role more efficiently, we also feel that she did not substantially address specific solutions for solving the disconnect between A.S. and the general student body.",,,,,,,,,,,,,,,,,,,
Vero Caveroegusquiza,Mark,External Vice President for Statewide Affairs,https://dailynexus.s3.us-west-1.amazonaws.com/dailynexus/wp-content/uploads/2023/04/23131033/Vero-Caveroegusquiza-headshot.-MarkAlfred_DailyNexus.jpg,https://dailynexus.com/2023-04-20/vero-caveroegusquiza-for-external-vice-president-for-statewide-affairs/,She/her,Third-year,Political science,"Platform Points: Caveroegusquiza’s platform points focus on expanding students’ basic needs resources, fighting for affordable, accessible and ethical housing, combating harmful investments made by the University of California and strengthening community alternatives to policing.","Endorsement: Caveroegusquiza’s experience as the current head of staff in the External Vice President for Statewide Affairs (EVPSA) office, coupled with her extensive work with grassroots activism groups and substantive understanding of marginalized communities’ needs, would lend themselves to an impactful tenure to the benefit of the student body.",,,,,,,,,,,,,,,,,,,
,,,,,,,,,,,,,,,,,,,,,,,,,,,,
Amelia Rowe,Sindhu,Off-Campus Senator,https://dailynexus.s3.us-west-1.amazonaws.com/dailynexus/wp-content/uploads/2023/04/23131427/Amelia-Rowe-2090.jpg,,She/her,First-year,History of Public Policy and Law,,,"I am running for Associated Students senate because I want to seek and amplify student
voices. When I first arrived on UCSB's campus, I had no idea what Associated Students was, or
where my fees go each quarter. Joining AS and working in the Strategic Operations Office this
past school year has shown me that our association can achieve anything: creating an accessible
transportation shuttle system, expanding EBT options in the community, and even bringing 200
iPads to students.

As a senator, I want to use my platform to not only amplify students' voices, I want to
increase campus awareness of AS programs and resources. I've often overheard conversations
where students express unique ideas that would greatly improve our campus and I believe the
senate should be taking greater action to bring these ideas to fruition.

I've built my goals around those outlined in the Student Strategic Plan, which includes
suggestions from students directly. During my time in office, I want to make syllabi available to
students directly on GOLD, create a transportation system between public transportation stops
in the area and campus to increase student safety, restart the AS Public Safety Commission, and
more.

Overall, I'm hoping to increase transparency and access to student representatives here. If you have any questions feel free to email me at ameliarowe@ucsb.edu!","Simply living in the Isla Vista/Goleta area has exposed me to the unique issues and
challenges that each student faces during their time here. This, paired with my time working in
the Strategic Operations Office has prepared me best to be a senator. I have come to understand
the goals of the association, the needs of the community, and the priorities of the student body.

Additionally I have been involved in several student organizations including Women in
Business and Her Campus UCSB, both of which have expanded my view of campus
organizations and student priorities.","While in office, I want to pass a resolution to stop the demolition of student health.
Each and every student should have access to healthcare on this campus, so I will resolve
to identify stakeholders and address the root of this issue. Associated students' lock-in
fees largely fund Student Health, so its demolition calls to question the presence of
adequate services to meet this overwhelming fiscal contribution.

Another goal of mine is to compile and market a list of financial resources
accessible to students. This goal is detailed under Philanthropy & Financial Support goal
#2 in the Student Strategic Plan. To achieve this, I will compile the resources and then
create a resolution to add the information to the Associated Students website. My ultimate
goal is to codify this resource and keep it updated.

Additionally, I want to create a bill to introduce an AS internal training program.
Ideally, I want to make information regarding associated students' processes more
accessible as a whole. I discuss this goal in more depth under question number 15.","My personal ideology is based on transparency, efficiency, and representation. To
achieve my goals in office, I will be resourceful and persistent.","So far, I have had the opportunity to work alongside entities like the Commission on
Student Well-being, Public & Mental Health Commission, and the Human Rights Board to
complete projects and discuss student well-being. In the future, I hope to continue working with
these entities to achieve our shared goals.

Additionally, I hope to form relationships with the Isla Vista Tenants Union, Isla Vista
Community service district, and other off-campus organizations to further the association’s
goals.","As outlined in Associated Students legal code, I will hold three weekly office hours
in person in one of the appropriate outlined off-campus locations. In addition to in-person
office hours, I intend on holding a zoom office hours session to accommodate those with
scheduling, transportation, or health issues prohibiting them from attending in person. I
want to help increase transparency between myself and my constituents, so not only will I
be available during these times, I will respond quickly to emails and social media

Amelia Rowe
messages, create a google form with a space for anonymous suggestions, and schedule
appointments promptly when requested.","I am the best candidate for this position because I understand when to listen and when
to act. The best student representatives are those who can acknowledge and appreciate the fact
that we will never fully understand the challenges and trials each individual student faces. I will
never know what it’s like to be persecuted based on my race, religion, or gender identity. While
I have faced my own challenges, my perspective alone can’t account for the thousands of
students I will represent as a senator.

What makes me a qualified candidate for off-campus senate is my ability to tune in and
take note of students' voices. This quality is vital to ensure I represent all of my constituents,
and not just those with similar interests to me.",Left-leaning,"Good.  While the 73rd senate definitely faced challenges, I have
worked alongside many of these senators and know that they have been operating in good faith
and working towards several goals to improve the lives of their constituents. There is always
room for improvement, but I believe that the 22-23 senate has addressed the needs of the
student body well.",Yes,"Yes. Tuition was first charged to UC students in 1970
following a strong push from Ronald Reagan and his administration. It’s vital
we understand the historic socio-economic and political implications of
charging tuition for a public university. Education should be free, and should not be used to leverage power over those who can not afford or access it.","After attending the town hall meeting addressing mental health services at UCSB, I
have a better understanding of the services available to students. While the resources available
are comprehensive - there are still gaps. From conversations with other students and mental
health advocates, I have found two areas UCSB is currently lacking in:

1. Peer group mental health groups. I have heard from other students that there is a
lack of comprehensive group counseling services available. Peer group services
take pressure off of students and create a unique space for students to share and
relate with one another regarding mental health issues.
2. Accessibility of existing resources. Resources are not typically widely available,
and are not compiled adequately. There needs to be a comprehensive database of
mental health resources available. There are a ton of amazing services students
are not taking advantage of, despite their fees funding these services, and
increasing student awareness of these resources is key to improving our impact
on students.

I believe that mental health services at UCSB can be improved but currently cover a
diverse range of issues. To address this problem our association can work with CAPS and other
student organizations or entities with a stake in mental health to make them aware of the gaps
in services here on campus and ultimately improve the services offered.","As stated on the university’s Title IX office website, “The mission of the Title IX and
Sexual Harassment Policy Compliance Office (Title IX Office) is to ensure all UCSB
community members fulfill the campus’ commitment to create and maintain a work and
academic environment free of sex discrimination, sexual harassment and sexual violence.” To
support survivors of sexual assault, this office should work efficiently to provide students with
resources, create safety nets including emergency alarm stations on campus and in the
surrounding community, and take appropriate disciplinary action against those who violate Title
IX in any form to ensure the safety and well-being of students with all gender identities on our
campus.","For the most part, UCSB students and faculty have a great appreciation for diversity
here on campus. As our community continues to progress and strive to make our campus a safe
and comfortable space for ALL students, it’s important to acknowledge and condemn those
who uphold systems of oppression and discrimination on our campus. Opening conversations
for those who are uneducated is the first step. Events like the Trans Town Hall and instituting
land acknowledgements across all UCSB programming are great first steps.

I believe that UCSB is making a great effort to serve historically underrepresented
groups, and I sincerely hope we can continue this effort and make this a more accepting
environment for students with all identities and from all backgrounds.","As a senator, I will take action to improve students' experience just as I have in my
current position. The first action I want to pursue is solidifying training for new associated
students members - a goal outlined in the Student Strategic Vision document. When I joined, I
didn't know how to reach out to senators, bring forward ideas, or where to go to accrue funding.
A more streamline entry process would greatly improve the state of associated students as a
whole - allowing students to work more effectively in their positions.

Amidst internal dysfunction, it's important we evaluate the root of issues and work to
solve them internally. In a more efficient space, we'll be able to achieve our common goal: to
help and serve our constituents. I would also hope to make this information available to all
students. If they’re more aware of what the senate can do for them, I think they’d take
initiative, sponsor bills and even suggest new ones.","One of the biggest issues I’ve observed as both a student and a member of the
association is lack of awareness about what associated students does and how it impacts our
campus. Many students are simply unaware of how to get involved, how their fees are
allocated, and why it’s important to vote in these elections.
As a senator, my first action would be establishing a consistent social media presence.
I’d like to detail the projects being progressed throughout the association and discuss the ways
we are working to improve upon flaws still present at the university. My next step would be
continuing to work with the Strategic Operations Office and Chief Operating Officer to build
their database of current and past projects that target student’s goals for the association. Working in strategic operations this past year has shown me the potential for their website to
serve as a palatable database - one that students can easily click through to familiarize
themselves with each entity and branch in associated students.

Most importantly, I want to listen to students and work towards the things most
important to them. Often I think student representatives are so focused on their personal goals
they ultimately lose view of the most pressing issues on campus. Continuing to engage with
students, dropping in on organization meetings, and liaising with students during office hours",NO ANSWER,NO ANSWER,NO ANSWER
Leon Barhoum,Nisha,On-Campus Senator,https://dailynexus.s3.us-west-1.amazonaws.com/dailynexus/wp-content/uploads/2023/04/23131606/Leon-Barhoum-2059.jpg,,,,,"5/17 Correction: A previous version of this elections guide included questionnaire answers that Barhoum did not submit, this guide has been updated to reflect that Barhoum did not submit any questionnaire answers.",,,,,,,,,,,,,,,,,,,,
