Levi Corlew,,Off-Campus Senator,,,He/Him,1st,Environmental Studies,,,I'm running to improve the quality of life for students ,"I think the traditional way for becoming a senator is through working in one of the Associated Students' organizations, however, I wasn't a part of AS. I feel like another way of being prepared to be a senator is just by being a student, because the best representatives for students are students. And I think I have a solid understanding of the student experience and all of the challenges that come with it. ","1. A resolution demanding that the university divests from war and instead invests in its students
2. A bill that prevents AS student fees being spent on companies that profit off of war
3. A resolution demanding that the university implements meal swipe rollover and guest swipes","I want to use the Associated Students and its organizations and networks to help unify and amplify the students' voices so we can more effectively demand that the university address our basic needs, such as having more affordable housing, a more affordable education, and reducing food insecurity. To achieve these goals, I plan on working with as many senators, AS organizations, and AS executive offices to collectively voice our demands to the administration. ",Any group that's down to help,"I'll have in person office hours that are accessible by zoom, they can schedule a meeting with me, and I'll check my email regularly",I think that I'm a good candidate because I'm ready to dedicate myself to improving the lives of students and I want to make sure everyone can reach their full potential and thrive here on campus,Left-leaning,Poor,Yes,"Many students have expressed their desire for this campus to divest from war. I mean, that's one of the main things on the first floor of the library, besides the silly looking nap pods.",Yes,"In order to have the most amount of people escape poverty, higher education and education in general need to have the least amount of restrictions so people can easily access that education and the increased career options that can come with it. Tuition is one of these restrictions that acts as a barrier to entry and reduces the amount of people that pursue a degree. So I believe that we should transition to a tuition-free system in the quickest and most sustainable way.",I believe that the university should provide more funding for CAPS to ensure that it has the capacity to meet all of the needs for the students that rely on it,"I think that the university should take each report seriously and do their best to investigate each case. Additionally, survivors should be given the full support of the university and provided with the resources to help them heal","No, UCSB is not. For the 2023-2024 school year, black students made up 1.8% of the undergraduate student body (420 out of 23,232), while black Californians made up 6.5% of the total population of California. Native American students made up 0.13% (31 out of 23,232), while Native American Californians made up 1.7% of the total population of California. These stats show that UCSB is not doing nearly enough to serve marginalized groups.","Firstly, I would push to update the senate website since it hasn't been updated in 2 years, and list all the members of the senate, including their email and office hours. I would also push to upload all of the notes and proposed legislation on the website and instagram so people would have adequate time to comment on it. Additionally, I would push to fill any empty senate seats in a timely special election. ","I think the Senate's role is to respectfully listen to the student body and create a safe space where students can voice their opinions, and then make decisions that represent the students' concerns. ","Personally, I wouldn't have let that slide "
Aryaman Singh,,Engineering Senator ,,,he/him,2,Computer Science ,,,"I am running to be a senator with the 75th senate because I believe I can bring meaningful change, not only to the College of Engineering but also campus wide. As senator, I will focus on pushing admin to add more industry related courses to the College of Engineering as a whole, uplifting traditionally underrepresented minorities in the College of Engineering, meal rollover and reform, and the  housing crisis in Isla Vista UCSB students face.","I have been involved with External Vice President of Statewide Affairs as a Community Outreach Liaison, and the Director of Events at Google Developer Students Clubs. Both of these positions have taught me both how to lead and also how to be involved and listed to the community of UCSB students.","1) A bill that gives established minority(based on sex, gender or race) groups in colleges special status which gives them easier access to funding and any other kind of support they may need.

2) A resolution for ALL tuition to be invested in students or students interests.

3) A resolution to call upon Admin to create or modify an increased number of courses in the College of Engineering to be industry focused to give students real life experience.","I advocate for the introduction of more courses that are directly tailored to the realities of the engineering industry. These courses should not only cover advanced technical skills but also emphasize project management, teamwork, and problem-solving in real-life scenarios.


Along with this, I want to push for an environment in the College of Engineering that fosters an inclusive and supportive environment for all students, especially those from minority groups who have been traditionally underrepresented in engineering fields","Google Developer Student Clubs
CodersSB
Society of Women Engineers","I am ALWAYS accessible through emails and will respond to any email I receive. If anyone wishes to meet me, they can drop in during my office hours, and if that doesn’t work they can email me and set up an appointment. Both zoom and in person works for me.","I think that my experience with leadership, my hardworking nature, my tenacity, and my genuine interest in making both CoE and UCSB a better place for everyone makes me the best candidate for this position.",Left-leaning,Poor,Yes,"I would vote in favor of a resolution to divest in alignment with the Boycott, Divestment and Sanctions movement for any and all companies that allegedly profit from human right violations in any country.",Yes,"I believe that Education should be free, as every person has the right to education and restricting it to only those who can afford it is terrible. Education is something that can uplift all communities. If not tuition-free, then more affordable at the minimum.","I do not believe it is adequate, CAPS does not have the capacity to handle the amount of students at UCSB. Investing in CAPS, expanding its office and duties would be the best way to solve this problem. Mental Health services is not going to do anyone any harm, and more of it that needed is not an issue, but less that needed definitely is.",,,"1) Utilize social media platforms to provide updates on Senate activities, decisions, and opportunities for involvement. This would include concise summaries of meeting topics, outcomes, and how they impact the student body.

2) Implement robust and user-friendly feedback mechanisms, such as online surveys or suggestion boxes placed around campus. Feedback would be regularly reviewed during Senate meetings, ensuring that student voices are heard and considered in decision-making processes.","During this time of division and hostility among students concerning the Israel-Palestine issue, the Senate's role should be one of a peacemaker, aiming to calm tensions and foster a peaceful campus environment. The Senate should prioritize listening to all student voices, creating a safe space where students can express their concerns and perspectives in a respectful and safe atmosphere. Communication from the Senate should be frequent, transparent, and inclusive, emphasizing unity and the common values of respect and understanding. Instead of taking sides or making statements that could exacerbate the situation, the Senate should focus on activities and communications that promote dialogue, mutual respect, and understanding among the student body.","I believe the signage resulted in community backlash as many signs targeted people specifically and said things like “You can run but you cannot hide”. I am absolutely against and statements like these, but the doxxing of MCC faculty is absolutely unacceptable and should never have happened. If I was a senator, I would hold the people responsible for the doxxing and any actions that made the situation worse. I think the senate should have listened to student voices and approved the recall election."
Caroline Lankarani,,Off Campus Senator,,,they/them/theirs,3rd,"History of Art & Architecture, Anthropology",,,"I'm not running because I think ""oh this will be a fun opportunity"", I'm running because I actually want to see and make change. This past year I've been extremely disappointed in how our current senate has conducted business regarding divestment, condemning islamophobia and antisemitism, and the doxxing of 24 BIPOC students. If we want to see change, we must act. I have no plans to ever run for any government, but after seeing injustice constantly being perpetuated, I need to make the change I want to see. ","I have been involved in Associated Students for almost a year as the BCU Liaison for the A.S. Commission on Culture, Arts, and Joy Justice. This role has allowed me to practice my communication skills with other student organisations to plan events, coordinate, fundings, and brainstorm ideas for activities.","1) Divestment of student fees and tuition from funding war and the military industrial complex, with plans to invest those funds into our student body
2) A proper bill to properly address, define, and condemn islamophobia, antisemitism, and xenophobia on and off-campus.
3) Allocation of funding to promote a safe and healthy UCSB by purchasing masks, hand sanitizer, and disinfectant wipes to all major lecture halls and classrooms. These supplies would be distributed to students, but not required, for free. ","My platform is to call and act for the justice that desperately needs to be served for BIPOC students. We cannot foster a campus climate fueled by hatred, we must create a space for all voices to be heard and all needs to be properly addressed. ","I hope to work alongside Student Health, CAPS, and CARE to address the mental health needs of UCSB students. A.S. CCAJJ works to promote art and collective liberation as a means to create an inclusive environment for all students, and I would love to work with campus groups that want to educate our peers and have fun.","I check my email at least 3 times a day so students can send me an email and it will be answered in a timely manner. In addition, if I'm elected I will hold hybrid ""office hours"" at the Arts Building once a week to meet with students. My schedule should be pretty flexible, and if students can't make it to my ""office hours"", I will go out of my way to meet at a time that works for them.","I'm dedicated to amplifying and platforming the voices of underrepresented students, I'm willing to listen to my constituents and make sure that the needs of our students are met in a timely manner, and I'm willing to compromise and accept criticism. ",Left-leaning,Very Poor,Yes,"Our students fees and tuition shouldn't be funding from companies that profit from human suffering, and we shouldn't be taking their money either.",Yes,"As a public university, UCSB should be serving anyone that wants to pursue higher knowledge. UCSB received over $200 million in federal funding 2022-23, so why do they need more from struggling students?Thanks, Reagan.","Mental health services are absolutely necessary on our campus, but do not have the current capacity or resources in order to properly serve our student population. We need to allocate funding in order to expand and adequately pay more psychologists and therapists to assist our students who are struggling. ","I am familiar with the Title IX office and its functions on campus, but as a whole the university needs to do a LOT more to support survivors of sexual assault and harassment. The Title IX office can only investigate claims within the scope of their jurisdiction, and if they are unable to further work on a case it is usually met as a dead end. Students Against Sexual Assault (SASA) does amazing work to support survivors, and we must work alongside them to make sure students and survivors are heard and properly brought to justice. ",,"I want to invite as many student organizations as possible, off and on-campus, to collaborate with the senate on passing legislation that benefits everyone. Isla Vista is a community of students, alumni, families, and many more, and as Off-Campus Senator I want to listen and take action for those living off-campus. I would encourage my fellow senators to hold public forums in addition to official senate meetings and provide a space for students to come forward and express their needs as our constituents. ","During this time the Senate needs to stay representative of ALL students, however, should not amplify voices with intentions of hate or oppression of others. No one's comfort should come at the cost of another's, and even though talking about the ongoing genocide of Palestine and its people is seen as ""complicated"" to some, we cannot allow our university to continue its contributions to military contracting and war. Period. War benefits no one, and we cannot allow our university and its students to perpetuate it. ","The A.S. Senate handled this completely immaturely. One of this year's senators has claimed that Students for Justice in Palestine ""supports Islamic terrorism"", but has provided no examples nor gave his definition of ""Islamic terrorism"". Members of senate have abused their power to push a narrative that they were ""victimized"" by signage and have built massive online followings and doing brand deals with their new-found followings, which is completely unacceptable and inappropriate. As well as silencing minority-led student groups, the senate has blatantly shown their biases. 
If I were senator when this took place, I would target the source of the problem: why were these signs placed in the MCC in the first place? Because students felt that their elected leaders were not listening to their needs for a ceasefire resolution and solidarity with the people of Palestine. "
