Emily von Zedtwitz,Holly,Off-Campus Senator,https://dailynexus.s3.us-west-1.amazonaws.com/dailynexus/wp-content/uploads/2023/04/23131501/Emily_von_Zedtwitz.jpg,,She/Her,First-Year,Political Science,,,"I have always been dedicated to public service and policy making. The role of a Senator
combines these passions and my commitments are demonstrated in my current
position serving as an On-Campus Senator and working on issues that directly benefit
you.","Nominated and appointed an On-Campus Senator during the academic year required
me to adapt and learn quickly to meet the demands of Senate responsibilities. Involved
in various activities, I am a member of the AS External Affairs Committee, club swim,
UCSB political affiliated club through which I resonate with diverse groups within the
university’s student population. As a fluent Mandarin and German speaker with
overseas experience, I can relate to and represent a broad student population’s
interests and needs. Additionally, I will also be able to represent Greek Life as I plan
on joining the pre-professional law fraternity.","Currently, only half of IV’s 23,000 residents are UCSB students, with a substantial
remaining SBCC tenant population. I will negotiate a housing priority for UCSB
students with the Tenants Union to secure rental leases ahead of SBCC students.
Additionally, I will advocate for increased bus frequency and expand routes to reduce
additional transportation costs for students living in more affordable towns.
Ultimately, SBCC is located roughly 20 minutes from Isla Vista, while UCSB is in its
immediate proximity. As UCSB students deserve housing preference in Isla Vista,
negotiations with the IV Tenants Union is indispensable to relieving thousands of
UCSB students from falling victim to the housing crisis.
Everyone can relate to the experience of having to catch up two weeks into the quarter
after being taken off the waitlist for a course someone drops last minute. The syllabus

provided during the first week outlines the subject in depth, sets student expectations,
and informs on workload, often acting as the final determinant to whether students
opt to remain or drop the class. I will propose a mandate for professors to post their
syllabus, clarifying content and workload on GOLD during course registration to avoid
this issue.
Following the outsourcing of dental and vision services, the Ocean Road Project is
proposing to demolish the Student Health Building without the consent of the student
body. The University’s failure to adequately provide healthcare services including
reproductive care, vision and dental care, addiction counseling, medical services, and
physical therapy would blatantly disregard the health and safety of its students. As
Senator, I will work to ensure that the university establishes a permanent facility that
continues to provide the same quality of care.","As a current senator, I have been actively engaging with the student body from all
levels to represent their voice and working closely with fellow senate members to
work out policies and introduce new bills for implementation in alignment with the
university administration and using my position in the External Affairs Committee to
involve other external organizations as necessary. To ensure the student body keeps
up with AS ongoing initiatives and progress, I will work with fellow senators to
promote timely communication of AS resources offered and ongoing progress of
initiatives on social media, school news outlets, and postings on campus bulletin
boards.","As my first platform aims to maximize off-campus housing opportunities for UCSB
students, I plan to work with the IV Tenants Union to negotiate housing priority. My
second platform targeting course registration difficulties necessitates the
involvement of the university administration, GOLD technicians and professors.
Third, ensuring students' continued accessibility to healthcare on campus requires
negotiation and active engagement with the university administration to provide
equivalent healthcare alternatives for our students.","Aside from holding weekly office hours where students can come to me with concerns,
I plan on introducing a Monthly Forum, a direct platform of open communication
between the student body and Senators, in which anyone can attend.","From my ongoing role as an On-Campus Senator, I have developed the knowledge and
network critical to carry out this job. Strong creativity, problem-solving and
interpersonal communication skills equip me to effectively negotiate and influence
others towards a consensus or compromise in implementing change. Additionally,
having grown up overseas, I am familiar with Asian, European and American cultures
and perspectives that allow me to relate to diverse interests, needs and ideas.","(d) Other (less than 30 words):
I believe in decision making based on student body input and interests, irrespective of
my personal political beliefs.","(e) Poor
Please explain (less than 100 words):
The 74th A.S. Senate has been marked by internal strife with leadership turnovers that
has negatively affected its functionalities and ability to execute its duties. In addition,
the process of passing bills and resolutions has been excessively and unnecessarily
cumbersome, resulting in little progress in implementing improvements.","Human rights violations are a very serious issue that needs to be studied carefully and
confirmed as to the reasons and the culprits. As a formal institution, our university
governing body should not engage with parties that continue to support and profit
from such violations.","(b) No
Please explain (100 words):
The university requires substantial funding to attract top professors and invest in
programs that allow it to operate as a top academic institution. Currently, UCSB
funding comes from both the state and student tuition. If UCSB were tuition-free and
state sponsored, other UC campuses would also follow suit for this privilege which
would be too great of a burden for the state, setting an unsustainable precedent. As
need-based financial aid is currently available and granted to eligible students that
meet the criteria, there is no need to consider a tuition-free university.","While the university’s Counseling & Psychological Services (CAPS) does offer several
mental health programs ranging from a one-time one-on-one consultation (Let’s
Talk program) to a 24/7 crisis line, its service availability is not sufficient. As first
hand experience, making an appointment requires several steps including paperwork
and multiple call transfers that amounted to no one answering the calls during
operating hours, which may discourage students from using these services. The
university needs to hire enough personnel to handle these calls during operating
hours.","Victims of sexual assault must often confront health problems including anxiety,
depression, and PTSD. Lack of anonymity when reporting a Title IX complaint may
further hinder victims from coming forward. The university can better support
victims unwilling to reveal their identity with an anonymous counseling hotline.","I can only speak to historically marginalized groups that I can personally identify
with. UCSB’s various Asian student organizations exceeded my expectations of
supporting my Asian identity through hosting events, recognition of cultural holidays,
and providing us with a safe space to discuss issues we face as a historically
underrepresented minority. However, allowing right-wing extremists to use
university facilities to spread hateful speech and propel their agenda exposed the
university’s failure to comply with their commitments to diversity, equity, and
inclusion, as well as a failure to protect all marginalized groups.","Course registration based on pass times is not only a stressful experience, but
simultaneously produces extremely unfinalized schedules. Students often count on
waitlists to be accepted into a course, relying heavily on other students to drop. As a
result of this uncertainty in enrollment, students are often faced with the dilemma of
having to decide whether or not to do the work of the class they are hoping to switch
out of as acceptance off a waitlist can take up to two weeks. Students usually end up
dropping after realizing that a course’s high student expectations and workload
amount prevents a balanced schedule. If elected, I will work to ensure that professors
post their syllabus, including their student expectations, content, and workload, on
GOLD during course registration so that students register for a class they want to be in
from the start.","As your senator, I will propose to send monthly emails to the student body with the
purpose of involving and informing students about progress on ongoing initiatives, all the services and resources it offers, as well as to solicit direct student input. At the
same time, I will recommend collaborating with Daily Nexus to keep students
informed. Our social media presence on Instagram and Facebook provides an
additional source of communication. Students are always welcome to come to my
weekly office hours, and are invited to attend Senate meetings.","As elected officials, these allegations need to be taken very seriously. I would have
sought to gather information and evidence to confirm or reject the allegations. Senate
meetings must be held according to the predetermined schedule where there is a
quorum. To ensure financial integrity and transparency in managing the budget of
over $12 million, I would recommend to perform an independent audit with a report
on uses of funds. Any violations of regulations and unethical behaviors should be
referred to a disciplinary body with a trial to hear cases and impose penalties in the
form of service hours or fines as necessary.","Any removal of senior leadership positions must first include a thorough investigation
with evidence showing negligence, incompetence or failure to discharge duties before
a democratic vote by the Senators where a majority should prevail.","Honoraria is awarded upon a thorough review of application to ensure eligibility. The
Senate Finance Subcommittee is responsible to set up the approved honoraria and
ensure timely payment to the approved team members. As an annual audit at year end
is to be conducted, any missed payment would be detected and made up in time."
Enri LaLa,,Letters & Science Collegiate Senator,https://dailynexus.s3.us-west-1.amazonaws.com/dailynexus/wp-content/uploads/2023/04/23131508/Enri_Lala.jpg,,he/him,First-Year,History,,,"There were two reasons that made me decide to run for Senator. Firstly, I am deeply passionate
about issues which are best addressed by the Senate, from reforming the housing process to
improving club funding and connecting our school to the community outside of our campus.
Secondly, I believe I have the ability to contribute to student government. Throughout the last
few years, whether by founding and presiding over an American Red Cross Club or through
public speaking, I have been working to improve both my communication and leadership skills,
which I consider the most important traits in a student leader. I believe in the effectiveness of
student government when the student body participates in the process, which I aim to enhance by
raising awareness of resources.
I will also offer a fresh perspective to student government. Growing up in Albania and
immigrating to the U.S. has given me a distinctive worldview, which will be a positive addition
to the plethora of different experiences represented on our campus. I believe being new to
UCSB’s student government will be an asset – after all, if we want to create a better campus, we
will need new voices and perspectives.","The two experiences that were most important in my decision to run for the Senate are as
different as they are equally important. The first of these has been participating in the Ethics
Bowl team, where we debate philosophy with colleges from around the country. This experience
has simultaneously developed my communication and leadership skills while making me more
aware of the problems with club funding on campus.
The second experience has been volunteering with the organization School on Wheels, with
which I tutor kids experiencing homelessness. This work has deepened my passion about making
a contribution in the homelessness crisis while also makimg me more aware of how much better
connected our campus needs to be with outside organizations if we want to make a positive
impact on the larger community.
Both of these experiences have shaped key parts of my platform. As Senator, I will work to
ensure that clubs are funded much more efficiently and that students have better opportunities to
work with organizations whose missions they are passionate about.","First in order would be a resolution demanding that the school administration match the
amount of new student housing built with increases in student population. I have come to
understand the importance of this issue by personal experiences and speaking to fellow
students. We cannot expect students to thrive if they do not have secure access to basic
needs such as housing. To solve this issue, it is crucial to understand its causes and make
sure that higher student enrollment does not continue to have negative consequences on
the student body. This can be accomplished by thoughtful and responsible
communication of student needs to the school administration.
2. Legislation to secure adequate club funding. A.S.'s sizable budget is common knowledge,
but so are the difficulties clubs face when seeking funding for their activities. While
recognizing that this is a complex process, I will work to present legislation ensuring that
each club receives the funding needed to succeed.
3. I aim to propose a resolution from the Senate ensuring that in the case of future internal
divisions, employee honoraria and other necessary funds be provided. This would be
crucial to fulfilling our duties as student representatives, maintaining the well-being of
employees on campus and restoring trust in student government.","My platform is defined by the goal of creating a prosperous and united campus. To achieve this
objective, I have identified some of the most pressing issues our campus faces. Firstly, to reform
the housing process we will need not only the student government to act but to communicate
with and hold the school administration accountable. The second platform issue, that of
improving club funding, can be resolved by a more effective student government. I aim to better
communicate with all clubs on campus regarding their needs, so that each one is equipped to
prosper. Thirdly, fostering better connections between our campus community and outside
organizations will take relentless work by both student leaders and individual students. As a
Senator, I will contribute to this vision by contacting outside organizations while coordinating
efforts with members of our campus. Finally, I recognize that in order to fulfill this vision it is
crucial to constantly communicate with, and receive feedback from, the students I represent.","I look forward to working with organizations already doing excellent work in our community,
especially the Isla Vista Community Services District and the Isla Vista Tenants Union on issues
concerning housing and beyond. I seek to be a new voice in student government, which will be
complemented by the experience such organizations have to offer.

Just as importantly, in order to expand our campus’ connections with the larger community and
offer students better opportunities, I aim to work with local organizations such as the Santa
Barbara City Council, the Santa Barbara Foundation and others. These collaborations are rooted
in the understanding that our campus plays a significant role in the larger community, and that
the more we are positively involved, the better.
Finally, as previously mentioned, I volunteer with the organization School on Wheels, which
helps students throughout Southern California. This experience has made me passionate about
enabling students to bring the organizations and activities they are passionate about closer to
campus.","Oftentimes the problem on our campus is not that resources aren’t available, but simply that
there is not enough awareness of them. This issue was one of the major reasons I decided to run
for Senator. I believe we will move beyond the image of student government as a “fake
government”, one which is inaccessible and out of touch, by connecting its work more personally
to each student. To achieve this, I will firstly make my my information readily available to all
students. But this is not enough. I aim to use my communication skills to build a better
connection between students and the government which represents them, addressing the issues
they are most concerned about and asking for feedback. I will encourage town-hall meetings,
where students will get to speak directly to their representatives.
It is just as important to make resources more accessible. I believe as much work needs to go into
presenting A.S. initiatives and programs to the student body as goes into preparing them. For
example, I will present a concrete idea: every event happening on campus should be sponsored
by a different campus organization, including a description letting students know what each
program offers. This would be effective in raising awareness of important resources on campus
without requiring any extra effort from students.","Passion and ability: I believe these two factors make me best suited to be a Senator.
Firstly, living on campus my first year has channeled my passion for public service toward the
most important issues and causes of our community. From reforming housing to improving club
funding and building a more involved campus, I will show an unparalleled level of commitment,
driven forward by a deep belief in what we as students are capable of. Secondly, while gladly
recognizing that I have much to learn, I have spent years building the abilities that are most
important in a student leader. My public speaking and debate experiences have made me more
effective as a communicator, while working with non-profit organizations and competitive teams
have taught me the value of leadership and organization. To create a better campus, we need new

ideas and fresh voices. I hope to be part of a new generation of student leaders who are willing to
sacrifice and put divisions aside, while being in constant communication with the students we
represent.
I have a clear vision of a strong and prosperous campus, and I believe I can make my
contribution to it by serving as a Senator.","(d) Other: I believe evaluating each policy decision before voting is much more valuable than
following any party line.","(d) Fair: While I do not discount the work the outgoing Senate has done to the benefit of the
community, I believe much of this effort was drowned out by a sense of disorganization, with
students viewing the Senate as a distant entity which was more concerned with its own issues
than theirs. These experiences should be seen as valuable lessons by the next generation of
Senators, so that we can provide a more effective and accessible student government.","c) Other: Being Albanian, I have often heard outsiders express opinions on my country’s
complex geopolitical issues in the Balkans when they did not know enough about the subject. I
believe it’s common courtesy for me not to do something similar with other issues. While I
strongly stand with the struggle for human rights around the world, I believe expressing an
opinion that is not fully formed would be counterproductive.","(b) I strongly believe that no student should be driven away from applying to or attending UCSB
because of the cost. This can be achieved by offering need and merit-based aid, including
full-ride scholarships, to as many students as possible, which would encourage equity and
fairness. For this to be achieved, however, we have to consider the full picture. This means that
those with the financial means to pay, in-part or in-full, should do so as far as they are capable.
Though I would agree with the proposition that some of what is covered through tuition could be

funded by the state or federal government, it is in part these tuition funds which provide the
experience and education we enjoy on campus.","Mental health resources on campus could be improved and made more accessible. To be clear, I
don’t believe that the issues with these resources as they currently exist are due to any
shortcomings by our dedicated staff. Rather, the UCSB student population has drastically
increased in recent years. With a larger student population, more resources need to be available –
with mental health services being among the most important. For example, every residence hall
could have a mental health resource center, making it easier for underclassmen to access help.
As Senator, I hope to start a conversation with the school administration and other stakeholders
about matching the resources the school offers with its larger student population. As previously
mentioned, for these resources to be effective, we also have to ensure better student awareness.","I am familiar with the Title IX office and the numerous valuable services it offers, all based on
ensuring students receive fair treatment regardless of gender, including in cases of sexual assault
and harrassment. The school can most effectively make an impact by increasing student
awareness of the resources at their disposal. Only if students know their rights can they make full
use of the functions of the Title IX office.","We could be doing more. As a History student, I am proud to be part of a campus which
recognizes the historical injustices that surround us. However, I believe it is time for us to go
beyond mere recognition. Let me offer a few examples: while recognizing that UCSB is founded
on the ancestral lands of the Chumash people is useful, we could be making a larger impact by
reaching out to Bands of the Chumash people and offering the resources at our disposal. While it
was crucial to recognize the acts of anti-Semitism that appeared in Isla Vista and on campus last
quarter, it is just as important to contact Jewish organizations in our community and coordinate a
response in solidarity. These efforts would both encourage higher student participation and
meaningfully connect our campus to the larger community.","One of the most pressing needs on our campus is addressing the housing crisis. This is why I aim
for my first resolution to be a request from the school administration to commit to providing
adequate housing for the growing student population, and to take concrete steps toward ensuring
that the number of students admitted does not negatively affect the student body.","The seeming inaccessibility of the Senate was a major factor in my decision to run. Besides
making all student representatives’ contact information readily available to the student
population, the most effective method to increase student awareness would be to have every
event on campus be sponsored by a different A.S. organization. These two initiatives would
ensure that students have better access to both their representatives and resources, an important
step towards making a better campus.","While I recognize that it is easier to comment on such matters from the outside, the level of
disorder that permeated the Senate is unacceptable. If faced with such a situation as Senator, I
would have prioritized communicating to my colleagues that as student leaders we have a higher
duty to the students we represent than to any conflicts that may emerge among us. In such
difficult circumstances, it is important to foster a sense of unity and remind those involved of the
common objective. It is also important to communicate with students and show that their
representatives are working to resolve conflicts.",NO ANSWER,"These backups were a major issue on our campus this school year, which I witnessed affect
multiple close friends of mine. I believe addressing issues of such importance are one of the few
instances where taking swift action is justified, whether by executives such as the President or by

enabling the Senate to meet under special circumstances. Whichever method is most effective
and best upholds the checks and balances of our system, we as student representatives have to
commit ourselves to always providing employee honoraria and other necessary benefits, and
recognize that not doing so would be a failure to fulfill our duties. As Senator, I hope to
introduce legislation setting up procedures for how to provide employee honoraria in cases
where the Senate’s functions are blocked."
Ephraim Shalunov,Asumi,Off-Campus Senator,https://dailynexus.s3.us-west-1.amazonaws.com/dailynexus/wp-content/uploads/2023/04/23131520/Ephraim-Shalunov-2061.jpg,,,,,,,,,,,,,,,,,,,,,,,,,
