Name,Editor,Running For,Photo URL,Endorsement URL,Pronouns,Year,Major,BlurbP1,BlurbP2,Q1,Q2,Q3,Q4,Q5,Q6,Q7,Q8,Q9,Q10,Q10a,Q11,Q11a,Q12,Q13,Q14,Q15,Q16,Q17
Dominic Wang,,Off-Campus Senator,,,he/they,2nd,Undeclared,,,"I am running to be a senator because in this past year, I have seen ridiculous abuses of power by AS Senate. To me, the 74th AS Senate is a bureaucratic mess. By running for AS Senate, I hope to cut through the bureaucracy, and be an advocate for students. Many people in AS senate have claimed to listen to students, but ultimately, students’ needs are still not being met. We are struggling to make ends meet. As someone who has experienced the struggle, I bring a fresh perspective and a simple goal; change. AS Senate spends its time arguing; simply put, I am sick of it.","I have been involved in mutual aid projects in Isla Vista; this is most of what motivated me to run. Working with Food Not Bombs Isla Vista, I’ve seen students who are barely making it paycheck to paycheck, or struggling to get food, and I’ve helped them. I have spoken to locals who talked to me about being pushed into homelessness by over admittance of students. I’ve handled tough situations with homeless people who are upset at their mistreatment. These experiences taught me the most vital part of aid is solidarity. I refuse to be a self-serving candidate; as I run, I remember the struggles that students experience, and I refuse to turn my back on our community.","The first bill I would like to introduce during my term is a divestment bill. The fact that AS senate sends money to Israel is ludicrous considering how many people are struggling here. I refuse to stand with the status quo and continue to let people starve here and be bombed in Gaza and shot in the West Bank. The second bill I would introduce is a bill to provide increased funding to community support groups, such as AS Food Bank, the IV Tenants Union, and Life of the Party. Harm reduction and food and housing aid are vital parts of our continued survival. These resources are underfunded and being ignored; I hope to change this. The third and final piece of legislation I would introduce is a resolution to condemn the UC’s actions with regards to the housing crisis. The UC continues to refuse to offer adequate care to students it has already admitted, while putting more incoming students in this position; this is unacceptable, dangerous behavior.","My main platform is divestment from war and reinvestment in community. This is pretty self-explanatory; the UC spends money investing in violence and colonization across the globe while ignoring the needs of its own students, who pay tuition. Instead of continuing to let this happen, I will work towards a divestment bill, and a reinvestment of this money into vital community safety groups. By pushing for divestment, I hope to open up a new pocket of money that could be used to hire housing advocates, fund the AS Food Bank, and provide more food, basic needs, and harm reduction services to the community.","I hope to work with the AS Food Bank to improve funding and work on the needs of the student body. I also hope to work with UCSB DSP to improve their notetaker programs, and increase funding to the Mobility Transportation Program. Furthermore, I hope to work with DSP, the Isla Vista Community Services District, and UCSB transportation services to improve the conditions of the roads and sidewalks in and around UCSB and Isla Vista. This would allow for students who are physically disabled to more easily travel around Isla Vista. Finally, I hope to work with the IV Tenants Union to increase the amounts of housing advocates available to students.","I am always reachable on Instagram! Furthermore, I will establish hours that I am reachable physically at the Arbor. Anyone who is interested in respectfully discussing their needs will be welcome. I will be an elected representative of the student body, and it will be my moral responsibility to listen to my constituents and represent their needs best. Furthermore, I will continue to volunteer with mutual aid projects in Isla Vista, including Food Not Bombs Isla Vista, and will continue to keep an ear to the ground with regards to the needs of homeless and housing insecure students. Unlike past elected officials, I will listen to you!","My experience is different than most candidates’, and in my opinion it makes me uniquely qualified to support constituents in material ways. My main source of experience is from mutual aid projects in Isla Vista; through these projects, I have learned that the most sustainable way to make change is through solidarity and action. I have learned from students who are housing insecure and homeless that the support they need is support that will last. I will stand in solidarity with every struggling student on and off this campus, and when it comes down to it, I will take any action necessary to fight for their needs.",Left-leaning,Very Poor,Yes,"I believe that UCSB spends too much money on the Gaza genocide, and not enough supporting its own students. Of course I will support a divestment resolution.",Yes,"College is an important educational step that opens so many doors. I believe that everyone is entitled to an education, no matter their financial background.","I do not believe that mental health services at UCSB are adequate; as someone who has struggled with mental health, UCSB’s mental health professionals are simply not reachable. CAPS therapists switch every few appointments and students who have spent time building a relationship with their therapists are thrown into the waters of a new person they do not know. This is not accessible therapy. Outside of UCSB, therapy is simply too expensive and difficult for many people to get. I believe that UCSB should invest more money into mental health services and hire more therapists so that every student who needs one can work with one for long periods of time. Furthermore, UCSB is an extremely high stress situation; it is not acceptable to continue to put students through these kinds of stresses. Class stress must be reduced.",,,"I believe AS senators actively make AS Senate more inaccessible for students; it’s impossible to read AS bylaw for example. Anyone trying to understand what AS senate is doing struggles. At the April 4th, 2024 Senate meeting, the behavior of AS Senators was so confusing and actively disruptive that many students hoping to make public comment for the meeting on the recall election of the current AS President were discouraged. This is an undemocratic way of acting. As someone who would constantly stay in communication with the student body, I will be available to communicate every decision with students who are confused. I will work on posts in conjunction with other Senators about the decisions made by AS Senate, explaining them to the general student body.","I believe Senate’s role during this time is to fight for the needs of the most marginalized of students. Senators should be acting out the needs of their constituents and they have not been. Instead of ignoring the demands of the student body for their own perspectives, they should represent. Furthermore, senators should be open about their perspectives. They should be honest about what they believe and what actions they are taking. As elected officials, senators need to understand that they need to represent the needs of students, and if they are not doing that, that they should at least be honest about it. They should not be allowed to claim neutrality.","I would not have approved of the MCC temporary suspension, because the MCC serves as a safe space for students of color, one of a few on this campus. The decision to suspend the MCC was quite frankly racist. I would have worked with other senators to present a united front and demand that the administration of UCSB reopen the MCC as soon as possible. Furthermore, I would have worked within my ability to protect the students who had been doxxed, while condemning the doxxers. I would have worked on a resolution with other Senators to condemn the doxxing of students, especially black, brown and Arab students."
Ella Yu,,International Senator,,,She/her,Sophomore,Communication and German,,,"I am running for the position of AS International Senator because I believe in the power of representation and advocacy for UCSB's diverse international student body. My passion for enhancing the UCSB experience for every international student is driven by my own experiences growing up in a multicultural environment in Shanghai and navigating various cultural landscapes. As a Communication and German major with extensive leadership experiences, including my role at the 2023 APEC Conference, I am uniquely positioned to bridge cultural gaps and promote an inclusive community at UCSB. My campaign is not just about a title; it's about making real changes that enrich our campus life, ensuring every international student feels welcomed, supported, and empowered.","My involvement in organizations such as CSSA’s International Cultural Exchange Department and my participation in the American Marketing Association and Women in Media has equipped me with the skills and insights necessary for this role. Organizing cultural events like the Spring Festival and Mid Autumn Festival has honed my ability to manage large-scale projects and foster communal ties. Additionally, my engagement in these groups has provided me with a deep understanding of the unique challenges and opportunities within our campus community, preparing me to effectively advocate for and support international students in the senate.","During my term, I plan to introduce the International Gaucho Nutritional Assistance Program to address dietary needs specific to international students, including partnerships with local eateries for discounts and cooking classes. Secondly, the International Career Fair & Legal Aid Initiatives will connect students with sponsors and provide essential legal workshops, preparing them for professional success in the U.S. Lastly, the Global Gaucho Integration & Orientation Program aims to facilitate smoother transitions for international students through pre-arrival modules and in-person orientation sessions focused on U.S. cultural and academic norms.","My platform is built on three pillars: nutritional support, career and legal aid, and cultural integration. To achieve these goals, I plan to collaborate with UCSB’s Food Bank, local businesses, career services, and legal experts to create programs that directly address the needs of international students. By leveraging existing resources and establishing new partnerships, I will ensure these initiatives not only launch successfully but also sustainably benefit students. Regular feedback loops will be established to continuously adapt and improve the offerings based on student needs and experiences.","To effectively implement my initiatives, I will partner with UCSB’s Food Bank, Career Services, and the Office of International Students and Scholars. Collaborations with other cultural and academic student organizations will also be instrumental in promoting and refining the programs.","I commit to being accessible to my constituents through regular office hours held both virtually and on campus to accommodate different schedules and preferences. I will also utilize social media platforms and email newsletters to keep students informed and engaged. Regular meetings and feedback sessions will be organized to discuss ongoing issues and gather input on new initiatives, ensuring transparency and responsiveness in my role.","My unique background as an international student from Shanghai, combined with my leadership experience and active participation in campus organizations, makes me the best candidate for this position. My proven track record of organizing successful cultural events and leading initiatives that promote inclusivity and understanding provides me with the insights and skills needed to effectively represent and advocate for UCSB’s international students. My dedication to creating a supportive and enriched campus environment is matched by a clear and actionable platform tailored to the needs of our diverse student community.",I choose not to publicly share my stance on this specific issue.,I choose not to publicly share my stance on this specific issue.,No," Please note that while I am required to select an option of 'Yes' or 'No' due to the format of this survey, I choose not to publicly share my stance on this specific issue at this time. The option I select should not be interpreted as an endorsement or rejection of the position. ",No," Please note that while I am required to select an option of 'Yes' or 'No' due to the format of this survey, I choose not to publicly share my stance on this specific issue at this time. The option I select should not be interpreted as an endorsement or rejection of the position.",,,,I choose not to publicly share my stance on this specific issue.,I choose not to publicly share my stance on this specific issue.,I choose not to publicly share my stance on this specific issue.
Lily Habas,,College of Creative Studies Senator,,,she/her,3rd,Art,,,"I am running for senator because I have felt disappointed by the mismanagement exhibited by the majority of the current senate during this year. Beyond issues within the Senate itself, progress has been stalled by a refusal to cooperate and senators feeding their political interests. I hope to be part of a senate that addresses the genuine needs of students without a desire for personal political gains, in addition to finally divesting student funds from war.","I have considered myself an organizer and activist for some time, but my involvement in the new UCSB chapter of Jewish Voice for Peace this year spurred me to make a change at the government level. The organization aligns with my personal anti-war and pro-divestment beliefs and has been a wonderful community for creating change at local and global levels.","My highest priority is cooperating with other senators on a resolution demanding the divestment of student funds from war by the university. Additionally, I am devoted to procuring ample funding to expand basic needs resources that have already been implemented at the university. I plan to introduce legislation that expands vital resources like the A.S. Food Bank, as well as a bill providing stronger protections and resources for all students facing housing insecurity both on and off-campus.","My platform focuses on outreach and addressing the needs of the student body by working directly with the student population. With many students feeling unrepresented and unheard this year, I hope to be a voice for all students, both within and outside of the College of Creative Studies. My goals will be achieved through cooperation with other students in the senate and a narrow focus on getting the work done, with no room for self-interest or bureaucratic games. My successful senate term will provide students with the resources they ask for and representation for those who have felt unheard.","This year, in particular, many campus organizations have expressed a feeling of disconnection with the Senate. I hope to foster a direct relationship with the vital campus organizations that desire change and progress for the campus community. A.S. entities such as the Commission on Disability Equality (CODE), IVTU, The Food Bank, and Black Womyn's Health Collaborative are just a few organizations that I look forward to working with.","Accessibility is very important to me, and it is particularly important for the needs of constituents. I believe holding frequent office hours as a Senator is an important duty, but having additional remote accessibility (such as over Zoom) is equally important. I'm hopeful that hosting casual CCS ""town hall"" meetings where students can express concerns and ideas will make constituents interested and excited about what is happening in the A.S. Senate.","Beyond spending 3 years thus far studying in CCS, I care for the well-being of my peers and the world around me. I have developed connections with students and organizations I would have never predicted, and feel more motivated than ever to create legitimate positive change for every student at UCSB. As a public university, I believe we must continue to make progress and represent an institution for the people, by the people. While this year's Senate has not been committed to this goal, I believe my election to this position will reinvigorate this commitment within the entire Senate and beyond.",Left-leaning,Very Poor,Yes,"As a Jewish progressive, this issue is dear to my heart. I am proudly anti-zionist and advocate for the liberation of all peoples, including all Palestinians living in occupied Palestine. Divesting our student funds from war is a key part of this movement toward collective liberation.",Yes,"I believe that education is a human right and should not be limited by a financial barrier. Beyond this, UCSB is a public university that already funds many students' educations through financial aid such as scholarships and grants. Free and quality education should be a possibility for everyone, regardless of meritocracy.","No, I do not believe mental health services at UCSB are adequate. CAPS is unable to serve the vast number of students who require and deserve quality mental health care despite how much the program is promoted. We must expand and improve this program to fit the needs of the large student population at UCSB.","I am familiar with the university's Title IX office, but I feel there is more work to be done to support survivors. The university must actively dismantle institutions that allow for assault to occur, particularly those affiliated with the university both on and off campus property. Additionally, I hope to work on expanding safety resources for students so that constituents can feel protected against assault without calling the police, which can sometimes do more harm than good for survivors.","I do not believe UCSB effectively serves historically underrepresented groups. The university chastises underrepresented groups for speaking out against injustice while simultaneously utilizing underrepresented groups to present a facade of diversity. Despite being a Hispanic-serving institution, many Latine students report frequent instances of discrimination and discomfort in classrooms and in the campus community. Black, Indigenous, and LGBTQ+ students face harassment and discrimination on and off campus despite the university's claims of progressiveness and equality. The university administration and government have a duty to serve these historically underrepresented groups and actively dismantle the conditions that produce discomfort and discrimination.","Despite the current inaccessibility, I believe that frequent emails, social media presence, infographics, and individual outreach will make a world of difference to involve the student body and keep them informed about Senate activities.","The Senate should represent the diverse beliefs of the student body while also advocating for and uplifting students. While the Senate does not have a responsibility to dictate the political and social beliefs of constituents, it does have a responsibility to act on behalf of the student body and support them. The Senate has done neither this year, which is the bare minimum for appropriate behavior during such a difficult time of suffering and crisis. Particularly, the Senate has an obligation to reach out to students and organizations who may be experiencing heightened suffering during this time, as well as protect students whose safety may be at higher risk due to their identity. ","Beyond refusing to take accountability, the 74th Senate made a mockery of the tragic doxxing of several students who were affiliated with the MCC. The President reposted the doxxing on public social media and later even admitted to not reaching out to the individuals who were doxxed or offering so much as an apology. The behavior of the A.S. government during and after this incident was embarrassing and unprofessional. As a Senator, I would have focused on de-escalation and protecting individuals who might have been at the most risk for retaliation, such as the individuals who were doxxed. My priority would have been keeping the MCC, which was not responsible for the signs, running, as it is a crucial campus space for so many students. Finally, I would have facilitated important community meetings for gathering and healing, as well as presented definitions and differentiations between anti-semitism and anti-zionism, which was wrongfully conflated by A.S. in the aftermath of the incident."
