Isabella McClintock,,Transfer Senator,https://dailynexus.s3.us-west-1.amazonaws.com/dailynexus/wp-content/uploads/2024/04/26133426/Isabella-McClintock.jpg,,She/Her,3rd ,Sociology,,,"I am running to be a senator in the 75th student senate to represent my fellow transfer students. As someone who has undergone the transition from community college to UCSB I understand the barriers transfer students face, including financial, educational, and social barriers. I want to be a voice for students who are integrating themselves into the greater UCSB community. I want to advocate not only for people who went from high school to community college and to university, but transfers who took any path to get to UCSB, including transfers from other universities, non-traditional/returning transfers, older transfers, and transfer students who are parents. ","I am currently the chair of the Transfer Student Alliance and have rebuilt the board from an inactive board to one that is fully operational within one quarter. Through TSA I have created a coalition with the Transfer Student Center and have passed funding requests to have collaborative events for transfers that foster community and increase outreach for campus resources. I also spend my free time working at the A.S. Pardall Center to further serve students within the Isla Vista community, a resource for students that offers free printing, computer usage, covid tests, and works closely in collaboration with the Legal Resource Center, Isla Vista Tenants Union, UCIV group, and IVCRC. In addition, I am a member of the UCSB Panhellenic community as a member of Gamma Phi Beta and have connections to outreach through the Greek community about campus events. ","I want to propose an amendment to the current legal code to expand the Transfer student seat since there is currently only one representative for the 33% of the undergraduate population that is transfer students. Transfers are currently being underrepresented and are in need of more advocacy when it comes to their perspective having a seat at the table when decisions about university life are being made. I want to propose a bill to administration about allowing Transfer students to reside in unused graduate student housing in the San Clemente Villages since there is a lack of safe and affordable housing for second year transfer students. Thirdly, I want to increase the minimum wage of student jobs on campus to $20/hour, since student employees are limited to 36 hours of work per paycheck at only $16/hour, students living below the poverty line are not earning a livable wage on top of university expenses. ","My platform is built on outreach, inclusion, representation and community. My time in office some of the goals I want to achieve include increasing the number of Transfer Senators, raising the student minimum wage to one that is livable, since many students do not have access to off campus jobs that provide better pay. I want to increase the accessibility to affordable mental health care, which means increasing the number of mental health care providers through CAPS to reduce wait times, and to allow students without health insurance a place to seek help without going into debt. Lastly, I want to work with administration to allow unused graduate student housing in the San Clemente villages to be allocated to housing insecure undergraduate students. All students should be allowed access to safe and affordable housing, and there should be no student left unhoused if there is leftover housing going unused. ","Some of the organizations I hope to work with in order to achieve my platforms includes continuing to work in conjunction with the Transfer Student Alliance, the Transfer Student Center, the Pardall Center, and the Isla Vista Tenants Union. In addition, I hope to work with the Commission on Student Well Being, the Public and Mental Health Commission to increase student access to mental health services that are affordable. I hope to work with Thrive and the Basic Needs Committee to have outreach to Transfer students who are unaware of the services such as loaner computers, cooking classes, and CalFresh workshops. I hope to work with my fellow senators and admin to pass resolutions for more affordable housing, and more transfer student representation on the senate. ","I will make myself available during my term as a senator by holding regular office hours both in person and online via zoom for students who are unable to meet in-person or who rely on accessibility tools that online platforms such as zoom provides. In addition I plan to hold quarterly or monthly town halls for Transfer students to relay their concerns and grievances about campus or community life. This way I will be able to be an active member of the senate who hears out student concerns and ensures that I am accurately representing and serving student needs. I will not be a senator who does not take their constituents into consideration, especially dealing with budget allocations that are funded directly from students pockets. I will follow the Brown act, releasing my agenda to the public before senate meetings are held to ensure transparency and to build trust within the students I serve.","I am the best candidate for the position because of my experience, skills in leadership, and genuine desire to help make campus an environment that students can thrive in. As the chair of an AS board, I already understand the intricacies of working within Associates Students from my current position in the Transfer Student Alliance. In addition to my experience at UCSB, I have worked in leadership positions since my time at community college where I was a senate liaison for my CC's student senate, and intern at the Student and Faculty Political Action Committee and volunteer at VIDA (Vasconcellos Institute for Democracy in Action) that lobbied in Sacramento for funding to community colleges to become have tuition free. In addition I am extremely passionate about Transfer student success and want to make UCSB a place where all Transfers feel welcome and supported by their community to not only further their education but grow as an individual in our school. ",Left-leaning,Very Poor,Yes,Our University should be a place that fosters growth and education. UCSB has no place in war or in genocide. We must divest. ,Yes,Higher education should be free. Nobody should have to put themselves into debt just to survive in our society. Universities should not be profiting off of students who are trying to better their chances at making a living within our economy.  ,"I believe that the student mental health services are not adequately fulfilling the needs of the student population as a whole. I think that CAPS is a stepping stone to what needs to be available for sufficient mental health care. I believe that the mental health services are overrun by students seeking help, with not enough staff to meet the demand. I know that referrals are offered for students who are not getting frequent enough care, but health insurance and transportation to off campus mental health care is not guaranteed for every student. I think that funding to expand the amount of providers needs to be made to make up for the demand of students that is currently not being met. ",,,"In question six I detailed the ways I would be accessible for students to report their grievances through town halls. During these, I will report out about what is happening within the senate to increase awareness and transparency. I will also advocate for more accessible senate meetings, such as ensuring there is a zoom option that adequately represents the meeting with clear audio and visuals. I would like to do outreach through the Daily Nexus or through KCSB, giving reports regularly to ensure our student press/media is aware of the inside happenings of senate. Most importantly, I will hold my fellow senators and student representatives accountable for doing the same. If a student representative is not willing to include and increase accessibility to the students they are serving, they should not be in office and I will make sure that if they fail to do so that it will be brought to the student body's attention. ",Senate's role during this time is to listen to the students they represent and understand their concerns and critiques. The senate should not be a platform for senators to express their individual self serving claims that are unrelated to the UCSB student population. Senate needs to increase their transparency to students trying to access their representatives. Senate needs to increase access to their office hours both in person and remote so they can successfully communicate with the student body they are representing. ,"The senate should have prioritized the safety and wellbeing of black and brown students who use the MCC as a place they feel comfortable on campus. The 74th senate severely let down the peers that they represent and should have put aside any political differences and start meaningful conversations about how to solve the problem of students feeling unheard, rather than escalating the situation and even risking the safety of students through their online platforms. As a senator I would have started an emergency town hall meeting for students within the MCC and other organizations to speak and to come up with solutions together."
Alex Arambula,,On-Campus Senator,,,He/She/They,Second,Applied Mathematics,,,"Every year the On-Campus Senator position is underfilled, only getting about one or two candidates every year (like this year!) of a total number of five. Students living in on-campus housing deserve a right to be adequately represented in the student government, and I aim to champion their voices into the wider Associated Students Senate.","I have been involved with my own hall council in Anacapa, KCSB (in both Sports and Archives), and UCSB's Anime Club. Through these, I have interacted and worked with several different kinds of people that go here, especially those who reside on campus. KCSB Archives in particular has allowed me access to archives that involve past Senates and how they have handled current events at the time, which gave me a great insight and want to become a Senator now.","A first bill I'd like to propose would be to change the meal-swipe system to allow swipes to roll over from one week to another, another bill I'd like to propose would be to remove the requirement to buy a meal-plan when staying on campus (as several students have expressed wishes to not feel forced to eat school food), and a third bill would be to pave a bike lane between the library and the ILP to avoid pedestrian/bicyclist accidents.","I'm running on a platform of meal swipe reform and transparency between developers of the San Benito Housing Complex. The meal swipe system is antiquated and unintuitive, being less than ideal for incoming first-year students on campus. I would introduce bills to change the meal swipe system to make it more accessible to utilize and (if students wish) to avoid it. As for San Benito, what mired the Munger Hall was its lack of transparency and student input until it was too late, but I will work with the HDAE to update the Student Housing Development website to include more information as the project progresses and allow for students to submit their own feedback to the future campus housing complex so we can avoid the pitfalls of the cancelled Munger Hall.","I hope to work with Housing, Dining, and Auxiliary Enterprises (HDAE), the Resident Housing Association (RHA), and the residence halls on campus to further my platform to changing the meal swipe system and increasing student knowledge and voices of and in the Student Housing Development process, hopefully making both fair and equitable.","I will be available regularly for in-person office hours at any of the three RHA offices, or any residence hall on campus. For a more remote experience, my email will always be open for comments or questions. I hope to see and hear from several on-campus residents in the 2024-2025 school year!","I have lived on campus for both of my school years here at UCSB, and I have worked with several residents and RHA in the past to better understand the populace of people living on campus. Additionally, my initiative in running for this office that so few others would is a testament to my willingness to serve the on-campus student body even if others consider this position ""cursed"".",Left-leaning,Poor,Yes,UCSB has more pressing issues than funding war criminals.,Yes,Education should be a human right.,"While I believe that the mental health services at UCSB are adequate for short-term therapeutic care, they tend to suffer with students who need longer-term care. UCSB should hire more professionals that are capable of providing individual long-term support for students suffering from mental difficulties that can't be easily solved through group sessions or workshops, but rather a program tailored specifically for them to get them to a better place mentally.","Title IX at UCSB nowadays seems equivalent to the Human Resources department at a company; it serves to UCSB and its image but not the students who allege misgivings people in power. There needs to be a fundamental reshaping of Title IX to focus on a victim-first mentality that gives alleged victims of harm from people in power the resources and confidence they need to get through such a horrific event, rather than trying to do damage-control to protect the image of abusers. ","As a bisexual Latine myself, I can only effectively comment on those two communities. For the LGBTQ+ community, while I think the campus offers a lot of events and safe spaces for queer people, it does very little to combat the pervasive homophobic and transphobic rhetoric of several students on campus who think their harmless ""jokes"" aren't harmful to students of those sexual and gender identities. As for Latines, El Centro has been threatened year after year by UCSB to either cut their funding or shrink their already dwindling presence on campus, effectively trying to cut out a major source of gathering for Hispanic students in a purportedly proud Hispanic-Serving Institution.","I would try to make by presence as an On-Campus Senator known to just about every student living in the residence halls at UCSB, allowing myself to be a source of knowledge for the first- and second-year students residing on campus, making it so they both understand the role of A.S. and learn ways for themselves to get involved in the student government, as well as how the student government is serving them. ",The Senate's role during this time is to try to quell the division of students at UCSB and act as a place where students share their views to their respective senators in a fair and democratic manner so that said senators can act in accordance with their constituents' beliefs and confidently explain how they are moving forward and why in relation to their constituents' remarks.,"The 74th Senate should have gone after those who were doxing others and appropriately saw to it that they were punished appropriately. If I were a Senator, I would have simply allowed those on both sides who sought more destructive and violent means of conveying their message to be appropriately punished for their unacceptable behavior, not just turn a blind eye to the misdeeds of those who agree with me."
Yasmine Suuck ,,Off-Campus Senator,https://dailynexus.s3.us-west-1.amazonaws.com/dailynexus/wp-content/uploads/2024/04/26133455/Yasmine-Suuck.jpg,,She/Her,2nd ,Political Science,,,I am running for A.S. senate because I am passionate about advocating for students and I feel I can make a difference in the organization. Currently A.S. is entrenched in various scandals increasing tensions between students on campus. I believe I can be a voice for students that feel marginalized as well as act as a vehicle for more cooperation. Without a functioning Senate students no longer have advocates. I am here to be your voice and ensure that you have someone constantly working to expand resources for student needs. ,"My involvement as an employee, member of various clubs, and students has prepared me for this position. I am a part of Campus Democrats which has allowed me to talk to students especially through voter registration during the midterm elections and year-round. My involvement with the Labor Caucus also allowed me to engage with workers on campus as well as in the Santa Barbara area that are fighting for better working conditions. I understand the challenges students face while trying to hold a part time job and being a full time student. I am determined to make your voices heard. 
","During my term I would like to work on helping students with housing, basic needs, and accessibility. Our university has not built adequate housing to accommodate our growing population. By engaging with students and university administrators I hope to alleviate the stressors surrounding housing. I also want to help students achieve better basic needs resources as living in Santa Barbara is very costly. This includes increasing funding for the A.S. Food bank which many students depend on for food security. Finally I want to work with A.S. as a whole to increase transparency and comprehensibility of the many resources this organization offers. ","My platform is to prioritize students and increase transparency in A.S.. Ultimately, the Senate is supposed to act for students and without students understanding the actions of the Senate it is no longer a truly representative organization. I will continue to talk to students about their goals and interests and bring them to the Senate to be discussed. I will work as hard as I can and engage with organizations and other senators to help our campus community. I also want to help students make the most of their tuition and fee spending at the university. This means expanding resources such as helping with the cost of living. I will also continue to connect students with these resources and make them easier to access. ",I would like to work with any organization that is interested in creating joint resolutions and bills. I am also interested in working with A.S. groups including the Trans and Queer commission and the Student commission on Racial Equity. Additionally I want to work with the IV tenants union in order to continue advocating for students in the current housing crisis. ,During my term I will make myself available always through email and instagram and respond in a timely manner. I will also host in person and zoom office hours for students that want to voice their concerns with me directly. Additionally for students that are intimidated by engaging with their elected candidates I am hoping to create a google form for students to fill out with any  concerns they may have or issues they would like to see the Senate deal with. ,I believe my commitment to hearing the voices of students as well as creating a more engaging senate makes me the best candidate for this position. I understand the struggle many students face with getting resources from A.S. as well as frustration around where my tuition money is being spent in the organization. I am not running to serve a personal agenda but to be a true representation of the student population. ,Left-leaning,Poor,Yes,"UCSB is an academic institution and it has no place in supporting companies that are actively engaging with death on the Gaza strip. A resolution from the Senate, I believe, would be very impactful and represent the interests of many students. ",No,"I believe that UCSB should have reasonable tuition in order to provide the best education for its students. I think tuition should be lowered, especially keeping in mind that we are a state university that is purposefully created to be more accessible to all students. ","I believe that mental health services including CAPS are vital for students at UCSB. I do however think that there needs to be a continuous improvement of this entity as our student population grows. I know students that have faced problems with scheduling an appointment, communicating with their providers, and switching providers when necessary. Mental health on campus is crucial for students and continuing to keep up resources can have a large impact on our community. ","I am familiar with the Title IX office and its role in supporting individuals who have experienced sexual assault or discrimination. I commend UCSB for its continued support of the office and its comprehensive website/platform for people to use. I think certain students may still be unfamiliar with the office so continuing to make the office a known resource could help students who have experienced sexual assault have an opportunity to seek justice. 
","I think we could be doing more to support students in historically underrepresented groups. UCSB has been making strides forward and continues to support organizations and events helping minority students. With this being said I know some students have felt marginalized and have experienced hate speech based on their identity. Continuing to educate ourselves, increase resources, and defend these students is vital in creating a better campus climate. 
","
The accessibility of A.S. is one of the key reasons why I am running this year. I will keep students informed through my personal contact and online presence. I will also work with A.S. on developing projects and events targeting students. 
","I have witnessed the division and hostility on campus and I believe that the Senate has a crucial role in mitigating this conflict. The Senate should represent the views of its constituents while also continuing to provide bills supporting other student needs. I believe Senators during a highly divisive time should always check in with students and ensure that they are hearing all of their voices, not just the voices they agree with. Continuing direct conversations with students and telling them about the complex processes of the Senate I believe will increase transparency and help to overcome division. 
","The 74th Senate had to deal with a very complex issue as well as a divided student body. It is easy to critique the Senate now and I want to recognize the work that many Senators have done to help represent students and solve the issues that were arising. I believe the suspension of the MCC for such an extended period of time neglects the needs of many students that use the MCC. The center holds many resources for marginalized students and continuing to restrict access has an immense impact on these students. The closing does not help in furthering discussion and punishes students who were not involved. I also think the Senate could have also engaged more with students, especially the students that were doxxed, instead of closing the MCC"
