Caleb Hanson,Sindhu,Off-Campus Senator,https://dailynexus.s3.us-west-1.amazonaws.com/dailynexus/wp-content/uploads/2023/04/23131437/Caleb_Hanson.jpg,,He/Him,First-year,Economics and political science double major,,,"I am running to be an off-campus senator to both improve the school and expand access to
necessary services on and off campus. As many of you know, important services such as CAPS,
CARE, tenant's rights services, and so many more are often overbooked and constantly
unavailable when students are in need of their assistance. I also have more than adequate
experience when it comes to student government, serving in some capacity from high school to
the current day. I believe this great school can soar above our greatest expectations under the

proper leadership and student government. I will work tirelessly to leave this school in a better
place than before I was elected, assuring the school is providing possibly life-saving services to
the students that pay thousands of dollars a year to attend. The final reason I am running is to
represent the students that live in isla vista. I will act as a voice that listens to the concerns of
those I represent and turn those concerns into bills that address the issues. I am ready to serve
the students of Isla Vista, and if elected, I will do everything I can to fix the problems students
in Isla Vista face every day.","Since starting at UCSB in the fall of 2022, I have been a part of UCSB’s Resident housing
association (RHA) as the representative at large for Santa Catalina South Tower. At the
beginning of the fall quarter, I was elected to represent my dorm (Santa Catalina) at the weekly
RHA Coordinating Board meeting. At these meetings, we would be presented with funding and
flyering requests to debate on and approve if they were in the best interests of the residents it
would be serving. Another responsibility of my position was planning events for the residents
to attend. I planned events aimed at helping residents deal with their stress, giving students
opportunities to snack and study with each other, and I am currently planning a major pride
event towards the end of the spring semester to give members of the LGBTQ+ community and
allies a fun event to celebrate pride with each other. I have worked hard over the past few
quarters to ensure residents' RHA activity fee is used to benefit them in the best way possible.
If elected as an Off-Campus Senator, I will continue to work to represent my constituents as I
have done my entire time as a part of the RHA.","I have numerous ideas for different bills or resolutions to introduce if I am elected, on top of
resolutions that members of my constituency would like me to introduce. The first bill that
comes to mind that I would like to introduce is an emergency temporary relocation bill. This
bill would set a plan and resources for students displaced throughout the year due to natural
disasters. It is no secret the current state of the cliffs in IV are deteriorating. It feels too often
that we see a post about a house on DP having part of its patio fall off into the ocean. We need
to be ready if students lose their houses due to erosion. The next bill I would introduce would
be to expand access to resources needed to protect tenants’ rights because it is all too common
for us young renters to be taken advantage of by leasing companies. The final bill I would like
to introduce would be to expand mental health resources such as CAPS and CARE because if
the school isn't providing adequate resources to help and protect its students, it is failing them. I
would continue introducing bills focused on ensuring students have the resources they need to
focus on their education.","My platform is based on assuring that the students of UCSB have the resources they need to
succeed and limit having to worry about basic needs. This includes making sure that everyone
has adequate access to mental health resources, food, and legal resources. If the school isn't
working to provide students who pay thousands of dollars in tuition each year with every
resource they need to finish their education, it is failing them. This is why I will work tirelessly
while I am in office, working with both internal and external groups associated with the school
to ensure that students are being taken care of. These organizations will include CAPS, CARE,
the AS food bank, the Pardall Center, and the Isla Vista Tenants Union, to name a few. I will
also work to pass legislation that works to fund these resources to an extent where they are
available and capable of helping all students who attend UCSB. A school will fail without the
proper means of supporting the student body. That is why the school needs to stand behind its
student body in all possible ways because when the students of UCSB succeed, so does the
school as a whole.","As I mentioned above, I plan on working with many different organizations to achieve the
platform I have laid out for myself. For mental health, I intend to work with CAPS, CARE, and
UCSB student health to ensure that our students have all the resources they need to care about
their education while still caring for themselves. For food security services, I will contact the
AS food bank and local stores in Isla Vista to ensure students can worry about their midterms
instead of worrying if they will be able to eat this week. The third set of organizations I intend
on working with are the ones that protect residents from landlords trying to pull a fast one on
young renters. I would work with the Pardall Center and the Isla Vista Tenants Association to
ensure they have the resources to provide tenants living in Isla Vista with the resources they
need to be successful renters. There are many other vital organizations that work as the
lifeblood of the UCSB student body. While I only name-dropped a couple in this response,
there are countless others that I intend to work with. I will work to assure that any resource that
can help students is available to all.","As part of my goal to be as transparent and accessible to all of my constituents as possible,
I will hold office hours each week that will be accessible both in person and online over
Zoom. I will publicly post the hours I will be available, making sure that anyone who
would like to get involved with school politics will be able to through me. I also intend to
have a system in which students will be able to leave comments or grievances that they
have with the current functions of AS. I hope this will garner more informal but important

feedback about the current view on the Senate's work. My final strategy for making myself
available to the student body is to create a social media platform where I can receive
feedback in a very informal way. This could be either message to the account, polls on a
story to gauge the student body's views or numerous other ways I could reach my
constituency. In an effort to demystify the workings of the UCSB AS senate, I will use my
platform to inform students about the current state of legislation and different ways that
they can get involved with the important issues.","Why am I the best candidate for this position? I believe that I am the best candidate because I
have devoted myself since I was 16 to serving the public in elected positions. From high school
all the way to now, I have held roles that involved me actively working to improve my
constituents' issues. I have the experience that is needed for this role and will work every day
once I am in the role to prove to my constituents that they made the right decision. I will work
tirelessly to write and pass legislation to better the school I call home. I am also currently
studying both economics and political science, which will have benefits both when it comes to
writing legislation, but also when it comes to funding programs and lowering the burden of
tuition on students. I will use the information I have gained over the years, on top of gathering
new information from my constituents about their needs to act as the best candidate and best
senator for them. I also believe that I have a unique perspective on campus issues from being a
part of the RHA. I got to see firsthand the issues that clubs and organizations had to deal with
on the daily. I will use this information to pass legislation that will benefit the UCSB
community as a whole.",Left-leaning,"Fair. I believe that the A.S. Senate this year has not necessarily
done a poor job, but it has been a boilerplate session in which nothing noteworthy changed.","Yes. I don't think that UCSB, a public government university,
should do any sort of business with a company that even just allegedly profits from human
rights violations","No. While I do believe that the current tuition is
ridiculous and understand that aid can only help so much, I do not believe
going completely tuition-free would be successful. Instead, I would tear the
current system to the ground and rebuild it to make college accessible to all.","I do not believe that the current mental health services are adequate for the UCSB student
body. Anyone who has ever tried to get an appointment at CAPS will tell you about the long
wait and seemingly impossible time they have scheduling an appointment. And then, after

they finally do, being able to find someone to consistently meet is a whole different
challenge. It's not the people who work at CAPS fault, they are doing the best they can with
the limited resources that they are given. That is why the main way to address this problem is
to allocate a bigger budget to mental health resources. Without them, our students cannot
thrive, which is why they need to be of such a high level of importance. By giving the mental
health services the resources they need instead of forcing them to work on what seems to be a
never-ending deficit, we will ensure the students' mental health is in good hands that can take
the time to fully engage with and help them through their troubles. I believe this is the only
way to truly bring our campus’ mental health services up to a satisfactory level for all
students.","I am familiar with the Title IX office and its function. Through my current elected position I am
registered as a mandated reporter, which has given me a pretty good understanding of the
functions of the Title IX office. I believe that one way the university could better support the
survivors of sexual assault is to better fund our mental health resources. I know I am beginning
to sound like a broken record but improved mental health outlets would benefit almost every
part of our school community. By expanding these resources to the students who need them and
would benefit from them, we could not only be there for our students but possibly save their
lives in the process. Along with expanding our mental health resources, I also believe that the
school would benefit from a campaign to spread not only awareness but also information about
how to support other students who are survivors struggling for support. In addition, removing
barriers that make it feel impossible for a survivor of sexual assault to come forward with their
stories and allow them to use the resources available is also key in supporting our students. No
student should have to be afraid to seek help at this university.","Here’s the thing with UCSB serving the underrepresented and my experience with it. As a
member of the LGBTQ+ community, I often think about this, and here is the conclusion I have
come to. The university tries to serve these communities, and you can tell, but it just doesn't
always come out right. It's kinda like being misgendered in public with your grandpa that
means well. His response being “He uses they/them pronouns”. They mean well, and you
appreciate the effort but there is definitely a lot of room for improvement. The entire SRB
serves students with essentially any resource center they may need with employees that
understand what the students are going through. I believe at this point in time, the best thing
that we can do is better fund the resource centers. With a larger staff and more resources,

students from historically underrepresented groups will have a place where they can feel safe
and supported. Another thing that could help these underrepresented communities is funding
events that promote inclusion and allows others to experience some of these communities'
traditions and culture. By doing this, we would further understand each other in possibly new
and unfamiliar ways, and promote inclusivity throughout our school.","The first bill that I would introduce would be the emergency temporary relocation bill. This bill
would focus on putting a plan in place as well as resources for students who lose their current
residence from things like natural disasters or cliffs falling on ocean-side DP. This bill would
also provide resources for temporary housing for people who have suffered from various kinds
of assault from their roommates or housemates. This program would also provide resources for
finding more permanent housing once they have been safely relocated. This program would
provide an essential service, especially for a city like DP, where we literally have houses slowly
but surely falling into the ocean. We need more programs and bills that benefit and work to
protect the students who are living off campus, which is a majority of our student population.
This bill would directly target one of the major fears that a lot of students have to deal with
when living in Isla Vista. It gives students another layer of protection when renting a house,
especially when renting companies in Isla Vista are known to be poor at serving their residents.
This would be the first of many important bills I will introduce to give students the necessary
resources.","There are multiple steps I intend to take that would demystify the entity that is A.S. The first of
these would be to grow a social media platform where I would be able to keep people informed
on the current status of the A.S. Senate. From this social media platform, I would provide
places for students to comment on current legislation, vocalize grievances, and possibly even
give their opinions via a poll posted on the account. I feel like we need to treat social media as
an asset in this day and age rather than act as though it is the enemy. By utilizing it as a tool, we
can reach a much larger portion of the base than possible with other tools. My second strategy
to increase involvement with A.S. is holding office hours in accessible ways and at accessible
times for students. One of the biggest problems with current office hours is that unless you
know about A.S., I would want office hours for all senators posted in a public place so that
students could much more easily contact their representatives. It is important that senators
remember who they are serving, and that is only made easier when students know how to
contact them.","Obviously, at that point in time, I was not a senator yet, so it is hard to say exactly how I
would’ve handled the situation had I been serving. If I had been a senator at this time, I
believe I would have worked to ensure that the Senate never got to the point where it was
forced to halt its operations for almost two months. I believe compassion and
understanding are rare but important in politics and that they need to be reintroduced
into all forms of politics. That being said, if the Senate were not being called to order, I
would first find ways to get mandatory issues dealt with even if the Senate wouldn’t meet.
I then would have attempted to find a way to possibly work things out between opposing
parties to reach a compromise. This way, the Senate could hold its integrity while
mitigating the problems at hand. I am running on a platform of serving the students'
needs and problem-solving, I will work as a senator that will go to those who I might
disagree with and work out a compromise so that both sides can leave happy and the
student body flourishes with a united body.","The separation of powers is always difficult to discuss because constitutions often leave
the powers vague and even overlapping in some parts. I believe that executive orders play
a key role in A.S. because, logistically, not everything can be legislated. It would take too
long and would end up not serving the students as much as it should. However, when an
executive order is used to override actions by a different body of government, that is
when it becomes questionable. Personally, I believe that the A.S. President did her job by
removing the IVP. The president's job is to keep the government running, even during
times of crisis. Gurleen did this when she removed the IVP, and it was in her right to do
so from the constitution. The most important aspect of this is to have a healthy and
impartial judiciary in place that would prevent any executive from abusing their powers.
So I guess to sum it all up, yes, I do believe that executive orders do have a place in
student government and that they play a key role in the day-to-day running of the
government. That being said, there needs proper oversight when it comes to executive
power because unchecked power leaves everything a little too messy.",
